Client is: 172.31.23.244
Server is: 172.31.44.118

Receive DNS query from client machine
    IP 172.31.23.244.36810 > 172.31.44.118.53: 11676+ A? www.twitter.com. (33)
    IP 172.31.23.244.36810 > 172.31.44.118.53: 36142+ AAAA? www.twitter.com. (33)

Server sends queries to i.gtld-servers.net.
    IP 172.31.44.118.41870 > 192.43.172.30.53: 46240 [1au] A? www.twitter.com. (44)
    IP 172.31.44.118.35925 > 192.43.172.30.53: 11659 [1au] AAAA? www.twitter.com. (44)

    IP 192.43.172.30.53 > 172.31.44.118.41870: 46240-| 0/9/1 (511)
    IP 192.43.172.30.53 > 172.31.44.118.35925: 11659-| 0/9/1 (511)
    IP 172.31.44.118.46183 > 192.43.172.30.53: Flags [S], seq 4058619667, win 29200, options [mss 1460,sackOK,TS val 2265677 ecr 0,nop,wscale 7], length 0
    IP 172.31.44.118.39417 > 192.43.172.30.53: Flags [S], seq 1239364474, win 29200, options [mss 1460,sackOK,TS val 2265677 ecr 0,nop,wscale 7], length 0
    IP 192.43.172.30.53 > 172.31.44.118.46183: Flags [S.], seq 3671192492, ack 4058619668, win 1460, options [mss 1460], length 0
    IP 172.31.44.118.46183 > 192.43.172.30.53: Flags [.], ack 1, win 29200, length 0
    IP 192.43.172.30.53 > 172.31.44.118.39417: Flags [S.], seq 177608647, ack 1239364475, win 1460, options [mss 1460], length 0
    IP 172.31.44.118.39417 > 192.43.172.30.53: Flags [.], ack 1, win 29200, length 0
    IP 172.31.44.118.46183 > 192.43.172.30.53: Flags [P.], seq 1:47, ack 1, win 29200, length 4613306 [1au] A? www.twitter.com. (44)
    IP 172.31.44.118.39417 > 192.43.172.30.53: Flags [P.], seq 1:47, ack 1, win 29200, length 4657490 [1au] AAAA? www.twitter.com. (44)
    IP 192.43.172.30.53 > 172.31.44.118.46183: Flags [P.], seq 1:773, ack 47, win 65535, length 77213306- 0/10/7 (770)
    IP 172.31.44.118.46183 > 192.43.172.30.53: Flags [.], ack 773, win 30108, length 0
    IP 192.43.172.30.53 > 172.31.44.118.39417: Flags [P.], seq 1:773, ack 47, win 65535, length 77257490- 0/10/7 (770)
    IP 172.31.44.118.39417 > 192.43.172.30.53: Flags [.], ack 773, win 30108, length 0
    IP 172.31.44.118.46183 > 192.43.172.30.53: Flags [F.], seq 47, ack 773, win 30108, length 0
    IP 172.31.44.118.46448 > 198.97.190.53.53: 10945% [1au] A? ns3.p34.dynect.net. (47)
    IP 172.31.44.118.58423 > 198.97.190.53.53: 18317% [1au] AAAA? ns3.p34.dynect.net. (47)
    IP 172.31.44.118.40775 > 198.97.190.53.53: 42694% [1au] A? ns4.p34.dynect.net. (47)
    IP 172.31.44.118.40376 > 198.97.190.53.53: 11259% [1au] AAAA? ns4.p34.dynect.net. (47)
    IP 172.31.44.118.40485 > 198.97.190.53.53: 43249% [1au] A? d01-01.ns.twtrdns.net. (50)
    IP 172.31.44.118.39431 > 198.97.190.53.53: 37157% [1au] AAAA? d01-01.ns.twtrdns.net. (50)
    IP 172.31.44.118.40306 > 198.97.190.53.53: 8144% [1au] A? d01-02.ns.twtrdns.net. (50)
    IP 172.31.44.118.49500 > 198.97.190.53.53: 52754% [1au] AAAA? d01-02.ns.twtrdns.net. (50)
    IP 172.31.44.118.44810 > 198.97.190.53.53: 64824% [1au] A? r01-01.ns.twtrdns.net. (50)
    IP 172.31.44.118.33850 > 198.97.190.53.53: 4921% [1au] AAAA? r01-01.ns.twtrdns.net. (50)
    IP 172.31.44.118.51285 > 198.97.190.53.53: 64737% [1au] A? r01-02.ns.twtrdns.net. (50)
    IP 172.31.44.118.59566 > 198.97.190.53.53: 9079% [1au] AAAA? r01-02.ns.twtrdns.net. (50)
    IP 172.31.44.118.55109 > 198.97.190.53.53: 61772 [1au] NS? . (28)
    IP 172.31.44.118.39417 > 192.43.172.30.53: Flags [F.], seq 47, ack 773, win 30108, length 0
    IP 198.97.190.53.53 > 172.31.44.118.46448: 10945-| 0/13/1 (268)
    IP 172.31.44.118.55695 > 198.97.190.53.53: Flags [S], seq 2167272010, win 29200, options [mss 1460,sackOK,TS val 2265713 ecr 0,nop,wscale 7], length 0
    IP 198.97.190.53.53 > 172.31.44.118.58423: 18317-| 0/13/1 (268)
    IP 172.31.44.118.37415 > 198.97.190.53.53: Flags [S], seq 3935224673, win 29200, options [mss 1460,sackOK,TS val 2265713 ecr 0,nop,wscale 7], length 0
    IP 198.97.190.53.53 > 172.31.44.118.40775: 42694-| 0/13/1 (268)
    IP 172.31.44.118.53131 > 198.97.190.53.53: Flags [S], seq 831810692, win 29200, options [mss 1460,sackOK,TS val 2265714 ecr 0,nop,wscale 7], length 0
    IP 198.97.190.53.53 > 172.31.44.118.40376: 11259-| 0/13/1 (268)
    IP 172.31.44.118.36341 > 198.97.190.53.53: Flags [S], seq 2298781548, win 29200, options [mss 1460,sackOK,TS val 2265714 ecr 0,nop,wscale 7], length 0
    IP 198.97.190.53.53 > 172.31.44.118.40485: 43249-| 0/13/1 (271)
    IP 172.31.44.118.44155 > 198.97.190.53.53: Flags [S], seq 3864431052, win 29200, options [mss 1460,sackOK,TS val 2265714 ecr 0,nop,wscale 7], length 0
    IP 198.97.190.53.53 > 172.31.44.118.39431: 37157-| 0/13/1 (271)
    IP 172.31.44.118.34607 > 198.97.190.53.53: Flags [S], seq 1417976679, win 29200, options [mss 1460,sackOK,TS val 2265714 ecr 0,nop,wscale 7], length 0
    IP 198.97.190.53.53 > 172.31.44.118.40306: 8144-| 0/13/1 (271)
    IP 172.31.44.118.43383 > 198.97.190.53.53: Flags [S], seq 4255577310, win 29200, options [mss 1460,sackOK,TS val 2265714 ecr 0,nop,wscale 7], length 0
    IP 198.97.190.53.53 > 172.31.44.118.49500: 52754-| 0/13/1 (271)
    IP 172.31.44.118.43681 > 198.97.190.53.53: Flags [S], seq 3075284255, win 29200, options [mss 1460,sackOK,TS val 2265714 ecr 0,nop,wscale 7], length 0
    IP 198.97.190.53.53 > 172.31.44.118.44810: 64824-| 0/13/1 (271)
    IP 172.31.44.118.46307 > 198.97.190.53.53: Flags [S], seq 2952229039, win 29200, options [mss 1460,sackOK,TS val 2265714 ecr 0,nop,wscale 7], length 0
    IP 198.97.190.53.53 > 172.31.44.118.33850: 4921-| 0/13/1 (271)
    IP 172.31.44.118.49341 > 198.97.190.53.53: Flags [S], seq 1909499448, win 29200, options [mss 1460,sackOK,TS val 2265714 ecr 0,nop,wscale 7], length 0
    IP 198.97.190.53.53 > 172.31.44.118.51285: 64737-| 0/13/1 (271)
    IP 172.31.44.118.59745 > 198.97.190.53.53: Flags [S], seq 441489456, win 29200, options [mss 1460,sackOK,TS val 2265714 ecr 0,nop,wscale 7], length 0
    IP 198.97.190.53.53 > 172.31.44.118.59566: 9079-| 0/13/1 (271)
    IP 198.97.190.53.53 > 172.31.44.118.55109: 61772*-| 0/0/1 (28)
    IP 172.31.44.118.41939 > 198.97.190.53.53: Flags [S], seq 383263426, win 29200, options [mss 1460,sackOK,TS val 2265714 ecr 0,nop,wscale 7], length 0
    IP 172.31.44.118.40243 > 198.97.190.53.53: Flags [S], seq 3924845344, win 29200, options [mss 1460,sackOK,TS val 2265714 ecr 0,nop,wscale 7], length 0
    IP 198.97.190.53.53 > 172.31.44.118.55695: Flags [S.], seq 2054144717, ack 2167272011, win 1460, options [mss 1460,nop,wscale 8], length 0
    IP 172.31.44.118.55695 > 198.97.190.53.53: Flags [.], ack 1, win 229, length 0
    IP 172.31.44.118.55695 > 198.97.190.53.53: Flags [P.], seq 1:50, ack 1, win 229, length 4940926% [1au] A? ns3.p34.dynect.net. (47)
    IP 198.97.190.53.53 > 172.31.44.118.37415: Flags [S.], seq 1131363285, ack 3935224674, win 1460, options [mss 1460,nop,wscale 8], length 0
    IP 172.31.44.118.37415 > 198.97.190.53.53: Flags [.], ack 1, win 229, length 0
    IP 172.31.44.118.37415 > 198.97.190.53.53: Flags [P.], seq 1:50, ack 1, win 229, length 495418% [1au] AAAA? ns3.p34.dynect.net. (47)
    IP 198.97.190.53.53 > 172.31.44.118.53131: Flags [S.], seq 1326446587, ack 831810693, win 1460, options [mss 1460,nop,wscale 8], length 0
    IP 172.31.44.118.53131 > 198.97.190.53.53: Flags [.], ack 1, win 229, length 0
    IP 172.31.44.118.53131 > 198.97.190.53.53: Flags [P.], seq 1:50, ack 1, win 229, length 4921307% [1au] A? ns4.p34.dynect.net. (47)
    IP 198.97.190.53.53 > 172.31.44.118.36341: Flags [S.], seq 2628401255, ack 2298781549, win 1460, options [mss 1460,nop,wscale 8], length 0
    IP 172.31.44.118.36341 > 198.97.190.53.53: Flags [.], ack 1, win 229, length 0
    IP 172.31.44.118.36341 > 198.97.190.53.53: Flags [P.], seq 1:50, ack 1, win 229, length 4932861% [1au] AAAA? ns4.p34.dynect.net. (47)
    IP 198.97.190.53.53 > 172.31.44.118.44155: Flags [S.], seq 4077368798, ack 3864431053, win 1460, options [mss 1460,nop,wscale 8], length 0
    IP 172.31.44.118.44155 > 198.97.190.53.53: Flags [.], ack 1, win 229, length 0
    IP 172.31.44.118.44155 > 198.97.190.53.53: Flags [P.], seq 1:53, ack 1, win 229, length 5254424% [1au] A? d01-01.ns.twtrdns.net. (50)
    IP 198.97.190.53.53 > 172.31.44.118.34607: Flags [S.], seq 470542408, ack 1417976680, win 1460, options [mss 1460,nop,wscale 8], length 0
    IP 172.31.44.118.34607 > 198.97.190.53.53: Flags [.], ack 1, win 229, length 0
    IP 172.31.44.118.34607 > 198.97.190.53.53: Flags [P.], seq 1:53, ack 1, win 229, length 5234516% [1au] AAAA? d01-01.ns.twtrdns.net. (50)
    IP 198.97.190.53.53 > 172.31.44.118.43383: Flags [S.], seq 2427894959, ack 4255577311, win 1460, options [mss 1460,nop,wscale 8], length 0
    IP 172.31.44.118.43383 > 198.97.190.53.53: Flags [.], ack 1, win 229, length 0
    IP 172.31.44.118.43383 > 198.97.190.53.53: Flags [P.], seq 1:53, ack 1, win 229, length 5250925% [1au] A? d01-02.ns.twtrdns.net. (50)
    IP 198.97.190.53.53 > 172.31.44.118.43681: Flags [S.], seq 3256302263, ack 3075284256, win 1460, options [mss 1460,nop,wscale 8], length 0
    IP 172.31.44.118.43681 > 198.97.190.53.53: Flags [.], ack 1, win 229, length 0
    IP 172.31.44.118.43681 > 198.97.190.53.53: Flags [P.], seq 1:53, ack 1, win 229, length 523494% [1au] AAAA? d01-02.ns.twtrdns.net. (50)
    IP 198.97.190.53.53 > 172.31.44.118.46307: Flags [S.], seq 1355882142, ack 2952229040, win 1460, options [mss 1460,nop,wscale 8], length 0
    IP 172.31.44.118.46307 > 198.97.190.53.53: Flags [.], ack 1, win 229, length 0
    IP 172.31.44.118.46307 > 198.97.190.53.53: Flags [P.], seq 1:53, ack 1, win 229, length 5227582% [1au] A? r01-01.ns.twtrdns.net. (50)
    IP 198.97.190.53.53 > 172.31.44.118.49341: Flags [S.], seq 1743849533, ack 1909499449, win 1460, options [mss 1460,nop,wscale 8], length 0
    IP 172.31.44.118.49341 > 198.97.190.53.53: Flags [.], ack 1, win 229, length 0
    IP 172.31.44.118.49341 > 198.97.190.53.53: Flags [P.], seq 1:53, ack 1, win 229, length 5243143% [1au] AAAA? r01-01.ns.twtrdns.net. (50)
    IP 198.97.190.53.53 > 172.31.44.118.59745: Flags [S.], seq 2908380446, ack 441489457, win 1460, options [mss 1460,nop,wscale 8], length 0
    IP 172.31.44.118.59745 > 198.97.190.53.53: Flags [.], ack 1, win 229, length 0
    IP 172.31.44.118.59745 > 198.97.190.53.53: Flags [P.], seq 1:53, ack 1, win 229, length 5232899% [1au] A? r01-02.ns.twtrdns.net. (50)
    IP 198.97.190.53.53 > 172.31.44.118.41939: Flags [S.], seq 3763918293, ack 383263427, win 1460, options [mss 1460,nop,wscale 8], length 0
    IP 172.31.44.118.41939 > 198.97.190.53.53: Flags [.], ack 1, win 229, length 0
    IP 172.31.44.118.41939 > 198.97.190.53.53: Flags [P.], seq 1:53, ack 1, win 229, length 528706% [1au] AAAA? r01-02.ns.twtrdns.net. (50)
    IP 198.97.190.53.53 > 172.31.44.118.40243: Flags [S.], seq 1562294857, ack 3924845345, win 1460, options [mss 1460,nop,wscale 8], length 0
    IP 172.31.44.118.40243 > 198.97.190.53.53: Flags [.], ack 1, win 229, length 0
    IP 172.31.44.118.40243 > 198.97.190.53.53: Flags [P.], seq 1:31, ack 1, win 229, length 3041339 [1au] NS? . (28)
    IP 198.97.190.53.53 > 172.31.44.118.55695: Flags [.], ack 50, win 6, length 0
    IP 198.97.190.53.53 > 172.31.44.118.55695: Flags [P.], seq 1:1178, ack 50, win 6, length 117740926- 0/15/27 (1175)
    IP 172.31.44.118.55695 > 198.97.190.53.53: Flags [.], ack 1178, win 247, length 0
    IP 198.97.190.53.53 > 172.31.44.118.37415: Flags [.], ack 50, win 6, length 0
    IP 198.97.190.53.53 > 172.31.44.118.37415: Flags [P.], seq 1:1178, ack 50, win 6, length 11775418- 0/15/27 (1175)
    IP 172.31.44.118.37415 > 198.97.190.53.53: Flags [.], ack 1178, win 247, length 0
    IP 198.97.190.53.53 > 172.31.44.118.53131: Flags [.], ack 50, win 6, length 0
    IP 198.97.190.53.53 > 172.31.44.118.53131: Flags [P.], seq 1:1178, ack 50, win 6, length 117721307- 0/15/27 (1175)
    IP 172.31.44.118.53131 > 198.97.190.53.53: Flags [.], ack 1178, win 247, length 0
    IP 198.97.190.53.53 > 172.31.44.118.36341: Flags [.], ack 50, win 6, length 0
    IP 198.97.190.53.53 > 172.31.44.118.36341: Flags [P.], seq 1:1178, ack 50, win 6, length 117732861- 0/15/27 (1175)
    IP 172.31.44.118.36341 > 198.97.190.53.53: Flags [.], ack 1178, win 247, length 0
    IP 198.97.190.53.53 > 172.31.44.118.44155: Flags [.], ack 53, win 6, length 0
    IP 198.97.190.53.53 > 172.31.44.118.44155: Flags [P.], seq 1:1181, ack 53, win 6, length 118054424- 0/15/27 (1178)
    IP 172.31.44.118.44155 > 198.97.190.53.53: Flags [.], ack 1181, win 247, length 0
    IP 172.31.44.118.43717 > 192.42.93.30.53: 22684% [1au] A? ns3.p34.dynect.net. (47)
    IP 198.97.190.53.53 > 172.31.44.118.34607: Flags [.], ack 53, win 6, length 0
    IP 198.97.190.53.53 > 172.31.44.118.34607: Flags [P.], seq 1:1181, ack 53, win 6, length 118034516- 0/15/27 (1178)
    IP 172.31.44.118.34607 > 198.97.190.53.53: Flags [.], ack 1181, win 247, length 0
    IP 172.31.44.118.49401 > 192.42.93.30.53: 54067% [1au] AAAA? ns3.p34.dynect.net. (47)
    IP 198.97.190.53.53 > 172.31.44.118.43383: Flags [.], ack 53, win 6, length 0
    IP 198.97.190.53.53 > 172.31.44.118.43383: Flags [P.], seq 1:1181, ack 53, win 6, length 118050925- 0/15/27 (1178)
    IP 172.31.44.118.43383 > 198.97.190.53.53: Flags [.], ack 1181, win 247, length 0
    IP 172.31.44.118.55695 > 198.97.190.53.53: Flags [F.], seq 50, ack 1178, win 247, length 0
    IP 198.97.190.53.53 > 172.31.44.118.43681: Flags [.], ack 53, win 6, length 0
    IP 198.97.190.53.53 > 172.31.44.118.43681: Flags [P.], seq 1:1181, ack 53, win 6, length 11803494- 0/15/27 (1178)
    IP 172.31.44.118.43681 > 198.97.190.53.53: Flags [.], ack 1181, win 247, length 0
    IP 198.97.190.53.53 > 172.31.44.118.46307: Flags [.], ack 53, win 6, length 0
    IP 198.97.190.53.53 > 172.31.44.118.46307: Flags [P.], seq 1:1181, ack 53, win 6, length 118027582- 0/15/27 (1178)
    IP 172.31.44.118.46307 > 198.97.190.53.53: Flags [.], ack 1181, win 247, length 0
    IP 198.97.190.53.53 > 172.31.44.118.49341: Flags [.], ack 53, win 6, length 0
    IP 172.31.44.118.37415 > 198.97.190.53.53: Flags [F.], seq 50, ack 1178, win 247, length 0
    IP 198.97.190.53.53 > 172.31.44.118.49341: Flags [P.], seq 1:1181, ack 53, win 6, length 118043143- 0/15/27 (1178)
    IP 172.31.44.118.49341 > 198.97.190.53.53: Flags [.], ack 1181, win 247, length 0
    IP 198.97.190.53.53 > 172.31.44.118.59745: Flags [.], ack 53, win 6, length 0
    IP 198.97.190.53.53 > 172.31.44.118.59745: Flags [P.], seq 1:1181, ack 53, win 6, length 118032899- 0/15/27 (1178)
    IP 172.31.44.118.59745 > 198.97.190.53.53: Flags [.], ack 1181, win 247, length 0
    IP 198.97.190.53.53 > 172.31.44.118.41939: Flags [.], ack 53, win 6, length 0
    IP 198.97.190.53.53 > 172.31.44.118.41939: Flags [P.], seq 1:1181, ack 53, win 6, length 11808706- 0/15/27 (1178)
    IP 172.31.44.118.41939 > 198.97.190.53.53: Flags [.], ack 1181, win 247, length 0
    IP 172.31.44.118.41675 > 192.42.93.30.53: 27135% [1au] A? ns4.p34.dynect.net. (47)
    IP 198.97.190.53.53 > 172.31.44.118.40243: Flags [.], ack 31, win 6, length 0
    IP 198.97.190.53.53 > 172.31.44.118.40243: Flags [P.], seq 1:1100, ack 31, win 6, length 109941339*- 14/0/27 NS a.root-servers.net., NS b.root-servers.net., NS c.root-servers.net., NS d.root-servers.net., NS e.root-servers.net., NS f.root-servers.net., NS g.root-servers.net., NS h.root-servers.net., NS i.root-servers.net., NS j.root-servers.net., NS k.root-servers.net., NS l.root-servers.net., NS m.root-servers.net., RRSIG (1097)
    IP 172.31.44.118.40243 > 198.97.190.53.53: Flags [.], ack 1100, win 246, length 0
    IP 172.31.44.118.38114 > 192.42.93.30.53: 29618% [1au] AAAA? ns4.p34.dynect.net. (47)
    IP 172.31.44.118.39475 > 192.42.93.30.53: 13886% [1au] A? d01-01.ns.twtrdns.net. (50)
    IP 172.31.44.118.54774 > 192.42.93.30.53: 38589% [1au] AAAA? d01-01.ns.twtrdns.net. (50)
    IP 172.31.44.118.42092 > 192.42.93.30.53: 43788% [1au] A? d01-02.ns.twtrdns.net. (50)
    IP 172.31.44.118.35015 > 192.42.93.30.53: 49521% [1au] AAAA? d01-02.ns.twtrdns.net. (50)
    IP 172.31.44.118.53131 > 198.97.190.53.53: Flags [F.], seq 50, ack 1178, win 247, length 0
    IP 172.31.44.118.36341 > 198.97.190.53.53: Flags [F.], seq 50, ack 1178, win 247, length 0
    IP 172.31.44.118.47542 > 192.42.93.30.53: 60722% [1au] A? r01-01.ns.twtrdns.net. (50)
    IP 172.31.44.118.39334 > 192.42.93.30.53: 8303% [1au] AAAA? r01-01.ns.twtrdns.net. (50)
    IP 172.31.44.118.44155 > 198.97.190.53.53: Flags [F.], seq 53, ack 1181, win 247, length 0
    IP 172.31.44.118.34607 > 198.97.190.53.53: Flags [F.], seq 53, ack 1181, win 247, length 0
    IP 172.31.44.118.43383 > 198.97.190.53.53: Flags [F.], seq 53, ack 1181, win 247, length 0
    IP 172.31.44.118.43681 > 198.97.190.53.53: Flags [F.], seq 53, ack 1181, win 247, length 0
    IP 172.31.44.118.32843 > 192.42.93.30.53: 24640% [1au] A? r01-02.ns.twtrdns.net. (50)
    IP 172.31.44.118.58786 > 192.42.93.30.53: 48168% [1au] AAAA? r01-02.ns.twtrdns.net. (50)
    IP 172.31.44.118.46307 > 198.97.190.53.53: Flags [F.], seq 53, ack 1181, win 247, length 0
    IP 172.31.44.118.49341 > 198.97.190.53.53: Flags [F.], seq 53, ack 1181, win 247, length 0
    IP 172.31.44.118.59745 > 198.97.190.53.53: Flags [F.], seq 53, ack 1181, win 247, length 0
    IP 172.31.44.118.41939 > 198.97.190.53.53: Flags [F.], seq 53, ack 1181, win 247, length 0
    IP 172.31.44.118.40243 > 198.97.190.53.53: Flags [F.], seq 31, ack 1100, win 246, length 0
    IP 192.43.172.30.53 > 172.31.44.118.46183: Flags [.], ack 48, win 65535, length 0
    IP 192.43.172.30.53 > 172.31.44.118.46183: Flags [F.], seq 773, ack 48, win 65535, length 0
    IP 172.31.44.118.46183 > 192.43.172.30.53: Flags [.], ack 774, win 30108, length 0
    IP 192.43.172.30.53 > 172.31.44.118.39417: Flags [.], ack 48, win 65535, length 0
    IP 192.43.172.30.53 > 172.31.44.118.39417: Flags [F.], seq 773, ack 48, win 65535, length 0
    IP 172.31.44.118.39417 > 192.43.172.30.53: Flags [.], ack 774, win 30108, length 0
    IP 192.42.93.30.53 > 172.31.44.118.49401: 54067-| 0/9/4 (499)
    IP 192.42.93.30.53 > 172.31.44.118.43717: 22684-| 0/9/4 (499)
    IP 172.31.44.118.59713 > 192.42.93.30.53: Flags [S], seq 2177081287, win 29200, options [mss 1460,sackOK,TS val 2265734 ecr 0,nop,wscale 7], length 0
    IP 172.31.44.118.35949 > 192.42.93.30.53: Flags [S], seq 2985052729, win 29200, options [mss 1460,sackOK,TS val 2265734 ecr 0,nop,wscale 7], length 0
    IP 192.42.93.30.53 > 172.31.44.118.41675: 27135-| 0/9/4 (499)
    IP 172.31.44.118.57497 > 192.42.93.30.53: Flags [S], seq 937964241, win 29200, options [mss 1460,sackOK,TS val 2265734 ecr 0,nop,wscale 7], length 0
    IP 192.42.93.30.53 > 172.31.44.118.38114: 29618-| 0/9/4 (499)
    IP 172.31.44.118.38117 > 192.42.93.30.53: Flags [S], seq 1354938558, win 29200, options [mss 1460,sackOK,TS val 2265734 ecr 0,nop,wscale 7], length 0
    IP 192.42.93.30.53 > 172.31.44.118.39475: 13886-| 0/10/6 (509)
    IP 172.31.44.118.56701 > 192.42.93.30.53: Flags [S], seq 534247260, win 29200, options [mss 1460,sackOK,TS val 2265735 ecr 0,nop,wscale 7], length 0
    IP 192.42.93.30.53 > 172.31.44.118.54774: 38589-| 0/10/6 (509)
    IP 172.31.44.118.56645 > 192.42.93.30.53: Flags [S], seq 1992380746, win 29200, options [mss 1460,sackOK,TS val 2265735 ecr 0,nop,wscale 7], length 0
    IP 192.42.93.30.53 > 172.31.44.118.35015: 49521-| 0/10/6 (509)
    IP 172.31.44.118.56583 > 192.42.93.30.53: Flags [S], seq 2559847732, win 29200, options [mss 1460,sackOK,TS val 2265735 ecr 0,nop,wscale 7], length 0
    IP 192.42.93.30.53 > 172.31.44.118.39334: 8303-| 0/10/6 (509)
    IP 172.31.44.118.60985 > 192.42.93.30.53: Flags [S], seq 1429298516, win 29200, options [mss 1460,sackOK,TS val 2265735 ecr 0,nop,wscale 7], length 0
    IP 192.42.93.30.53 > 172.31.44.118.42092: 43788-| 0/10/6 (509)
    IP 192.42.93.30.53 > 172.31.44.118.47542: 60722-| 0/10/6 (509)
    IP 172.31.44.118.45727 > 192.42.93.30.53: Flags [S], seq 3558369652, win 29200, options [mss 1460,sackOK,TS val 2265735 ecr 0,nop,wscale 7], length 0
    IP 172.31.44.118.47705 > 192.42.93.30.53: Flags [S], seq 3729542576, win 29200, options [mss 1460,sackOK,TS val 2265735 ecr 0,nop,wscale 7], length 0
    IP 192.42.93.30.53 > 172.31.44.118.32843: 24640-| 0/10/6 (509)
    IP 172.31.44.118.47223 > 192.42.93.30.53: Flags [S], seq 65862757, win 29200, options [mss 1460,sackOK,TS val 2265735 ecr 0,nop,wscale 7], length 0
    IP 192.42.93.30.53 > 172.31.44.118.58786: 48168-| 0/10/6 (509)
    IP 172.31.44.118.54701 > 192.42.93.30.53: Flags [S], seq 1555984597, win 29200, options [mss 1460,sackOK,TS val 2265736 ecr 0,nop,wscale 7], length 0
    IP 192.42.93.30.53 > 172.31.44.118.59713: Flags [S.], seq 336649708, ack 2177081288, win 1460, options [mss 1460], length 0
    IP 172.31.44.118.59713 > 192.42.93.30.53: Flags [.], ack 1, win 29200, length 0
    IP 172.31.44.118.59713 > 192.42.93.30.53: Flags [P.], seq 1:50, ack 1, win 29200, length 4923673% [1au] AAAA? ns3.p34.dynect.net. (47)
    IP 192.42.93.30.53 > 172.31.44.118.35949: Flags [S.], seq 4188702347, ack 2985052730, win 1460, options [mss 1460], length 0
    IP 172.31.44.118.35949 > 192.42.93.30.53: Flags [.], ack 1, win 29200, length 0
    IP 172.31.44.118.35949 > 192.42.93.30.53: Flags [P.], seq 1:50, ack 1, win 29200, length 4942709% [1au] A? ns3.p34.dynect.net. (47)
    IP 192.42.93.30.53 > 172.31.44.118.38117: Flags [S.], seq 3626676986, ack 1354938559, win 1460, options [mss 1460], length 0
    IP 172.31.44.118.38117 > 192.42.93.30.53: Flags [.], ack 1, win 29200, length 0
    IP 172.31.44.118.38117 > 192.42.93.30.53: Flags [P.], seq 1:50, ack 1, win 29200, length 4952879% [1au] AAAA? ns4.p34.dynect.net. (47)
    IP 192.42.93.30.53 > 172.31.44.118.57497: Flags [S.], seq 89037549, ack 937964242, win 1460, options [mss 1460], length 0
    IP 172.31.44.118.57497 > 192.42.93.30.53: Flags [.], ack 1, win 29200, length 0
    IP 172.31.44.118.57497 > 192.42.93.30.53: Flags [P.], seq 1:50, ack 1, win 29200, length 4912305% [1au] A? ns4.p34.dynect.net. (47)
    IP 192.42.93.30.53 > 172.31.44.118.56701: Flags [S.], seq 1979755154, ack 534247261, win 1460, options [mss 1460], length 0
    IP 172.31.44.118.56701 > 192.42.93.30.53: Flags [.], ack 1, win 29200, length 0
    IP 192.42.93.30.53 > 172.31.44.118.56645: Flags [S.], seq 2661689353, ack 1992380747, win 1460, options [mss 1460], length 0
    IP 172.31.44.118.56645 > 192.42.93.30.53: Flags [.], ack 1, win 29200, length 0
    IP 172.31.44.118.56701 > 192.42.93.30.53: Flags [P.], seq 1:53, ack 1, win 29200, length 5231673% [1au] A? d01-01.ns.twtrdns.net. (50)
    IP 172.31.44.118.56645 > 192.42.93.30.53: Flags [P.], seq 1:53, ack 1, win 29200, length 5270% [1au] AAAA? d01-01.ns.twtrdns.net. (50)
    IP 192.42.93.30.53 > 172.31.44.118.60985: Flags [S.], seq 4380791, ack 1429298517, win 1460, options [mss 1460], length 0
    IP 172.31.44.118.60985 > 192.42.93.30.53: Flags [.], ack 1, win 29200, length 0
    IP 172.31.44.118.60985 > 192.42.93.30.53: Flags [P.], seq 1:53, ack 1, win 29200, length 5258972% [1au] AAAA? r01-01.ns.twtrdns.net. (50)
    IP 192.42.93.30.53 > 172.31.44.118.56583: Flags [S.], seq 797268706, ack 2559847733, win 1460, options [mss 1460], length 0
    IP 172.31.44.118.56583 > 192.42.93.30.53: Flags [.], ack 1, win 29200, length 0
    IP 172.31.44.118.56583 > 192.42.93.30.53: Flags [P.], seq 1:53, ack 1, win 29200, length 524526% [1au] AAAA? d01-02.ns.twtrdns.net. (50)
    IP 192.42.93.30.53 > 172.31.44.118.47705: Flags [S.], seq 1398479856, ack 3729542577, win 1460, options [mss 1460], length 0
    IP 172.31.44.118.47705 > 192.42.93.30.53: Flags [.], ack 1, win 29200, length 0
    IP 172.31.44.118.47705 > 192.42.93.30.53: Flags [P.], seq 1:53, ack 1, win 29200, length 5224166% [1au] A? r01-01.ns.twtrdns.net. (50)
    IP 192.42.93.30.53 > 172.31.44.118.45727: Flags [S.], seq 479608217, ack 3558369653, win 1460, options [mss 1460], length 0
    IP 172.31.44.118.45727 > 192.42.93.30.53: Flags [.], ack 1, win 29200, length 0
    IP 172.31.44.118.45727 > 192.42.93.30.53: Flags [P.], seq 1:53, ack 1, win 29200, length 5235674% [1au] A? d01-02.ns.twtrdns.net. (50)
    IP 192.42.93.30.53 > 172.31.44.118.47223: Flags [S.], seq 314571419, ack 65862758, win 1460, options [mss 1460], length 0
    IP 172.31.44.118.47223 > 192.42.93.30.53: Flags [.], ack 1, win 29200, length 0
    IP 172.31.44.118.47223 > 192.42.93.30.53: Flags [P.], seq 1:53, ack 1, win 29200, length 523545% [1au] A? r01-02.ns.twtrdns.net. (50)
    IP 192.42.93.30.53 > 172.31.44.118.54701: Flags [S.], seq 915117774, ack 1555984598, win 1460, options [mss 1460], length 0
    IP 172.31.44.118.54701 > 192.42.93.30.53: Flags [.], ack 1, win 29200, length 0
    IP 172.31.44.118.54701 > 192.42.93.30.53: Flags [P.], seq 1:53, ack 1, win 29200, length 5248227% [1au] AAAA? r01-02.ns.twtrdns.net. (50)
    IP 172.31.44.118.37415 > 198.97.190.53.53: Flags [F.], seq 50, ack 1178, win 247, length 0
    IP 172.31.44.118.55695 > 198.97.190.53.53: Flags [F.], seq 50, ack 1178, win 247, length 0
    IP 172.31.44.118.40243 > 198.97.190.53.53: Flags [F.], seq 31, ack 1100, win 246, length 0
    IP 172.31.44.118.41939 > 198.97.190.53.53: Flags [F.], seq 53, ack 1181, win 247, length 0
    IP 172.31.44.118.59745 > 198.97.190.53.53: Flags [F.], seq 53, ack 1181, win 247, length 0
    IP 172.31.44.118.49341 > 198.97.190.53.53: Flags [F.], seq 53, ack 1181, win 247, length 0
    IP 172.31.44.118.46307 > 198.97.190.53.53: Flags [F.], seq 53, ack 1181, win 247, length 0
    IP 172.31.44.118.43681 > 198.97.190.53.53: Flags [F.], seq 53, ack 1181, win 247, length 0
    IP 172.31.44.118.43383 > 198.97.190.53.53: Flags [F.], seq 53, ack 1181, win 247, length 0
    IP 172.31.44.118.34607 > 198.97.190.53.53: Flags [F.], seq 53, ack 1181, win 247, length 0
    IP 172.31.44.118.44155 > 198.97.190.53.53: Flags [F.], seq 53, ack 1181, win 247, length 0
    IP 172.31.44.118.36341 > 198.97.190.53.53: Flags [F.], seq 50, ack 1178, win 247, length 0
    IP 172.31.44.118.53131 > 198.97.190.53.53: Flags [F.], seq 50, ack 1178, win 247, length 0
    IP 192.42.93.30.53 > 172.31.44.118.59713: Flags [P.], seq 1:936, ack 50, win 65535, length 93523673- 0/11/13 (933)
    IP 172.31.44.118.59713 > 192.42.93.30.53: Flags [.], ack 936, win 30855, length 0
    IP 192.42.93.30.53 > 172.31.44.118.38117: Flags [P.], seq 1:936, ack 50, win 65535, length 93552879- 0/11/13 (933)
    IP 172.31.44.118.38117 > 192.42.93.30.53: Flags [.], ack 936, win 30855, length 0
    IP 192.42.93.30.53 > 172.31.44.118.35949: Flags [P.], seq 1:936, ack 50, win 65535, length 93542709- 0/11/13 (933)
    IP 172.31.44.118.35949 > 192.42.93.30.53: Flags [.], ack 936, win 30855, length 0
    IP 192.42.93.30.53 > 172.31.44.118.56701: Flags [P.], seq 1:854, ack 53, win 65535, length 85331673- 0/12/7 (851)
    IP 172.31.44.118.56701 > 192.42.93.30.53: Flags [.], ack 854, win 30708, length 0
    IP 192.42.93.30.53 > 172.31.44.118.57497: Flags [P.], seq 1:936, ack 50, win 65535, length 93512305- 0/11/13 (933)
    IP 172.31.44.118.57497 > 192.42.93.30.53: Flags [.], ack 936, win 30855, length 0
    IP 192.42.93.30.53 > 172.31.44.118.56645: Flags [P.], seq 1:854, ack 53, win 65535, length 85370- 0/12/7 (851)
    IP 172.31.44.118.56645 > 192.42.93.30.53: Flags [.], ack 854, win 30708, length 0
    IP 192.42.93.30.53 > 172.31.44.118.60985: Flags [P.], seq 1:854, ack 53, win 65535, length 85358972- 0/12/7 (851)
    IP 172.31.44.118.60985 > 192.42.93.30.53: Flags [.], ack 854, win 30708, length 0
    IP 172.31.44.118.54846 > 204.13.251.136.53: 46463% [1au] AAAA? ns3.p34.dynect.net. (47)
    IP 172.31.44.118.59713 > 192.42.93.30.53: Flags [F.], seq 50, ack 936, win 30855, length 0
    IP 192.42.93.30.53 > 172.31.44.118.47705: Flags [P.], seq 1:854, ack 53, win 65535, length 85324166- 0/12/7 (851)
    IP 172.31.44.118.47705 > 192.42.93.30.53: Flags [.], ack 854, win 30708, length 0
    IP 192.42.93.30.53 > 172.31.44.118.56583: Flags [P.], seq 1:854, ack 53, win 65535, length 8534526- 0/12/7 (851)
    IP 172.31.44.118.56583 > 192.42.93.30.53: Flags [.], ack 854, win 30708, length 0
    IP 192.42.93.30.53 > 172.31.44.118.45727: Flags [P.], seq 1:854, ack 53, win 65535, length 85335674- 0/12/7 (851)
    IP 172.31.44.118.45727 > 192.42.93.30.53: Flags [.], ack 854, win 30708, length 0
    IP 172.31.44.118.41694 > 192.52.178.30.53: 34630% [1au] AAAA? ns4.dynamicnetworkservices.net. (59)
    IP 172.31.44.118.49332 > 204.13.251.136.53: 63731% [1au] AAAA? ns4.p34.dynect.net. (47)
    IP 172.31.44.118.38696 > 204.13.251.136.53: 58454% [1au] A? ns4.p34.dynect.net. (47)
    IP 172.31.44.118.56131 > 204.13.251.136.53: 4702% [1au] A? ns3.p34.dynect.net. (47)
    IP 192.42.93.30.53 > 172.31.44.118.54701: Flags [P.], seq 1:854, ack 53, win 65535, length 85348227- 0/12/7 (851)
    IP 172.31.44.118.54701 > 192.42.93.30.53: Flags [.], ack 854, win 30708, length 0
    IP 192.42.93.30.53 > 172.31.44.118.47223: Flags [P.], seq 1:854, ack 53, win 65535, length 8533545- 0/12/7 (851)
    IP 172.31.44.118.47223 > 192.42.93.30.53: Flags [.], ack 854, win 30708, length 0
    IP 172.31.44.118.37067 > 204.13.250.34.53: 8176% [1au] A? d01-01.ns.twtrdns.net. (50)
    IP 172.31.44.118.45114 > 204.13.250.34.53: 61351% [1au] AAAA? d01-01.ns.twtrdns.net. (50)
    IP 204.13.251.136.53 > 172.31.44.118.54846: 46463*- 1/7/1 AAAA 2001:500:94:1::34 (224)
    IP 172.31.44.118.37716 > 192.52.178.30.53: 43645% [1au] AAAA? ns2.dynamicnetworkservices.net. (59)
    IP 172.31.44.118.54973 > 204.13.250.34.53: 20046% [1au] AAAA? r01-01.ns.twtrdns.net. (50)
    IP 172.31.44.118.39470 > 204.13.250.34.53: 4226% [1au] A? r01-01.ns.twtrdns.net. (50)
    IP 172.31.44.118.38117 > 192.42.93.30.53: Flags [F.], seq 50, ack 936, win 30855, length 0
    IP 172.31.44.118.57497 > 192.42.93.30.53: Flags [F.], seq 50, ack 936, win 30855, length 0
    IP 172.31.44.118.35949 > 192.42.93.30.53: Flags [F.], seq 50, ack 936, win 30855, length 0
    IP 172.31.44.118.56701 > 192.42.93.30.53: Flags [F.], seq 53, ack 854, win 30708, length 0
    IP 172.31.44.118.40234 > 192.52.178.30.53: 2353% [1au] A? ns-370.awsdns-46.com. (49)
    IP 172.31.44.118.41471 > 192.52.178.30.53: 15874% [1au] AAAA? ns-370.awsdns-46.com. (49)
    IP 172.31.44.118.48004 > 204.13.250.34.53: 63574% [1au] AAAA? r01-02.ns.twtrdns.net. (50)
    IP 172.31.44.118.39452 > 204.13.250.34.53: 35021% [1au] A? r01-02.ns.twtrdns.net. (50)
    IP 172.31.44.118.34468 > 199.7.91.13.53: 979% [1au] A? ns-1450.awsdns-53.org. (50)
    IP 172.31.44.118.49677 > 199.7.91.13.53: 56395% [1au] AAAA? ns-1450.awsdns-53.org. (50)
    IP 172.31.44.118.38491 > 199.7.91.13.53: 39021% [1au] A? ns-1700.awsdns-20.co.uk. (52)
    IP 172.31.44.118.58233 > 199.7.91.13.53: 19073% [1au] AAAA? ns-1700.awsdns-20.co.uk. (52)
    IP 172.31.44.118.56645 > 192.42.93.30.53: Flags [F.], seq 53, ack 854, win 30708, length 0
    IP 172.31.44.118.39621 > 204.13.250.34.53: 16665% [1au] AAAA? d01-02.ns.twtrdns.net. (50)
    IP 204.13.251.136.53 > 172.31.44.118.49332: 63731*- 0/1/1 (131)
    IP 172.31.44.118.41831 > 204.13.250.34.53: 19959% [1au] A? d01-02.ns.twtrdns.net. (50)
    IP 199.7.91.13.53 > 172.31.44.118.34468: 979-| 0/0/1 (50)
    IP 199.7.91.13.53 > 172.31.44.118.49677: 56395-| 0/0/1 (50)
    IP 204.13.251.136.53 > 172.31.44.118.38696: 58454*- 1/7/1 A 204.13.251.34 (212)
    IP 172.31.44.118.60985 > 192.42.93.30.53: Flags [F.], seq 53, ack 854, win 30708, length 0
    IP 172.31.44.118.47705 > 192.42.93.30.53: Flags [F.], seq 53, ack 854, win 30708, length 0
    IP 172.31.44.118.54701 > 192.42.93.30.53: Flags [F.], seq 53, ack 854, win 30708, length 0
    IP 199.7.91.13.53 > 172.31.44.118.38491: 39021-| 0/0/1 (52)
    IP 172.31.44.118.47223 > 192.42.93.30.53: Flags [F.], seq 53, ack 854, win 30708, length 0
    IP 204.13.251.136.53 > 172.31.44.118.56131: 4702*- 1/7/1 A 208.78.71.34 (212)
    IP 199.7.91.13.53 > 172.31.44.118.58233: 19073-| 0/0/1 (52)
    IP 172.31.44.118.56583 > 192.42.93.30.53: Flags [F.], seq 53, ack 854, win 30708, length 0
    IP 172.31.44.118.45727 > 192.42.93.30.53: Flags [F.], seq 53, ack 854, win 30708, length 0
    IP 172.31.44.118.47649 > 199.7.91.13.53: Flags [S], seq 3604273296, win 29200, options [mss 1460,sackOK,TS val 2265775 ecr 0,nop,wscale 7], length 0
    IP 172.31.44.118.57633 > 199.7.91.13.53: Flags [S], seq 3952928385, win 29200, options [mss 1460,sackOK,TS val 2265775 ecr 0,nop,wscale 7], length 0
    IP 172.31.44.118.42703 > 199.7.91.13.53: Flags [S], seq 2108857510, win 29200, options [mss 1460,sackOK,TS val 2265775 ecr 0,nop,wscale 7], length 0
    IP 172.31.44.118.34147 > 199.7.91.13.53: Flags [S], seq 3667498241, win 29200, options [mss 1460,sackOK,TS val 2265775 ecr 0,nop,wscale 7], length 0
    IP 199.7.91.13.53 > 172.31.44.118.47649: Flags [S.], seq 1876520146, ack 3604273297, win 14480, options [mss 1460,sackOK,TS val 4144683007 ecr 2265775,nop,wscale 7], length 0
    IP 172.31.44.118.47649 > 199.7.91.13.53: Flags [.], ack 1, win 229, options [nop,nop,TS val 2265775 ecr 4144683007], length 0
    IP 199.7.91.13.53 > 172.31.44.118.57633: Flags [S.], seq 3885706739, ack 3952928386, win 14480, options [mss 1460,sackOK,TS val 4144683007 ecr 2265775,nop,wscale 7], length 0
    IP 172.31.44.118.57633 > 199.7.91.13.53: Flags [.], ack 1, win 229, options [nop,nop,TS val 2265775 ecr 4144683007], length 0
    IP 199.7.91.13.53 > 172.31.44.118.42703: Flags [S.], seq 3868499048, ack 2108857511, win 14480, options [mss 1460,sackOK,TS val 4144671988 ecr 2265775,nop,wscale 7], length 0
    IP 172.31.44.118.42703 > 199.7.91.13.53: Flags [.], ack 1, win 229, options [nop,nop,TS val 2265775 ecr 4144671988], length 0
    IP 199.7.91.13.53 > 172.31.44.118.34147: Flags [S.], seq 1380766470, ack 3667498242, win 14480, options [mss 1460,sackOK,TS val 4145168452 ecr 2265775,nop,wscale 7], length 0
    IP 172.31.44.118.34147 > 199.7.91.13.53: Flags [.], ack 1, win 229, options [nop,nop,TS val 2265775 ecr 4145168452], length 0
    IP 172.31.44.118.52819 > 204.13.251.34.53: 23826 [1au] A? www.twitter.com. (44)
    IP 172.31.44.118.49733 > 204.13.251.34.53: 39472 [1au] AAAA? www.twitter.com. (44)
    IP 192.52.178.30.53 > 172.31.44.118.41694: 34630-| 0/10/1 (503)
    IP 172.31.44.118.47649 > 199.7.91.13.53: Flags [P.], seq 1:53, ack 1, win 229, options [nop,nop,TS val 2265776 ecr 4144683007], length 5229678% [1au] A? ns-1450.awsdns-53.org. (50)
    IP 172.31.44.118.57633 > 199.7.91.13.53: Flags [P.], seq 1:53, ack 1, win 229, options [nop,nop,TS val 2265776 ecr 4144683007], length 5264961% [1au] AAAA? ns-1450.awsdns-53.org. (50)
    IP 172.31.44.118.42703 > 199.7.91.13.53: Flags [P.], seq 1:55, ack 1, win 229, options [nop,nop,TS val 2265776 ecr 4144671988], length 548249% [1au] A? ns-1700.awsdns-20.co.uk. (52)
    IP 172.31.44.118.34147 > 199.7.91.13.53: Flags [P.], seq 1:55, ack 1, win 229, options [nop,nop,TS val 2265776 ecr 4145168452], length 5417032% [1au] AAAA? ns-1700.awsdns-20.co.uk. (52)
    IP 172.31.44.118.50991 > 192.52.178.30.53: Flags [S], seq 1618516548, win 29200, options [mss 1460,sackOK,TS val 2265776 ecr 0,nop,wscale 7], length 0
    IP 199.7.91.13.53 > 172.31.44.118.47649: Flags [.], ack 53, win 114, options [nop,nop,TS val 4144683010 ecr 2265776], length 0
    IP 199.7.91.13.53 > 172.31.44.118.57633: Flags [.], ack 53, win 114, options [nop,nop,TS val 4144683010 ecr 2265776], length 0
    IP 199.7.91.13.53 > 172.31.44.118.42703: Flags [.], ack 55, win 114, options [nop,nop,TS val 4144671991 ecr 2265776], length 0
    IP 199.7.91.13.53 > 172.31.44.118.57633: Flags [P.], seq 1:826, ack 53, win 114, options [nop,nop,TS val 4144683010 ecr 2265776], length 82564961- 0/9/13 (823)
    IP 172.31.44.118.57633 > 199.7.91.13.53: Flags [.], ack 826, win 242, options [nop,nop,TS val 2265776 ecr 4144683010], length 0
    IP 199.7.91.13.53 > 172.31.44.118.47649: Flags [P.], seq 1:826, ack 53, win 114, options [nop,nop,TS val 4144683010 ecr 2265776], length 82529678- 0/9/13 (823)
    IP 172.31.44.118.47649 > 199.7.91.13.53: Flags [.], ack 826, win 242, options [nop,nop,TS val 2265776 ecr 4144683010], length 0
    IP 199.7.91.13.53 > 172.31.44.118.34147: Flags [.], ack 55, win 114, options [nop,nop,TS val 4145168455 ecr 2265776], length 0
    IP 199.7.91.13.53 > 172.31.44.118.42703: Flags [P.], seq 1:810, ack 55, win 114, options [nop,nop,TS val 4144671991 ecr 2265776], length 8098249- 0/10/14 (807)
    IP 172.31.44.118.42703 > 199.7.91.13.53: Flags [.], ack 810, win 241, options [nop,nop,TS val 2265776 ecr 4144671991], length 0
    IP 199.7.91.13.53 > 172.31.44.118.34147: Flags [P.], seq 1:810, ack 55, win 114, options [nop,nop,TS val 4145168455 ecr 2265776], length 80917032- 0/10/14 (807)
    IP 172.31.44.118.34147 > 199.7.91.13.53: Flags [.], ack 810, win 241, options [nop,nop,TS val 2265776 ecr 4145168455], length 0
    IP 192.52.178.30.53 > 172.31.44.118.37716: 43645-| 0/10/1 (503)
    IP 172.31.44.118.46144 > 156.154.103.3.53: 12500% [1au] A? ns-1700.awsdns-20.co.uk. (52)
    IP 172.31.44.118.33722 > 156.154.103.3.53: 20818% [1au] AAAA? ns-1700.awsdns-20.co.uk. (52)
    IP 172.31.44.118.57633 > 199.7.91.13.53: Flags [F.], seq 53, ack 826, win 242, options [nop,nop,TS val 2265777 ecr 4144683010], length 0
    IP 172.31.44.118.47649 > 199.7.91.13.53: Flags [F.], seq 53, ack 826, win 242, options [nop,nop,TS val 2265777 ecr 4144683010], length 0
    IP 192.52.178.30.53 > 172.31.44.118.40234: 2353-| 0/7/3 (508)
    IP 192.52.178.30.53 > 172.31.44.118.41471: 15874-| 0/7/3 (508)
    IP 156.154.103.3.53 > 172.31.44.118.46144: 12500-| 0/0/1 (52)
    IP 204.13.251.34.53 > 172.31.44.118.52819: 23826*- 3/9/1 CNAME twitter.com., A 104.244.42.65, A 104.244.42.1 (291)
    IP 172.31.44.118.54815 > 199.249.120.1.53: 14414% [1au] AAAA? ns-1450.awsdns-53.org. (50)
    IP 199.7.91.13.53 > 172.31.44.118.57633: Flags [F.], seq 826, ack 54, win 114, options [nop,nop,TS val 4144683016 ecr 2265777], length 0
    IP 172.31.44.118.57633 > 199.7.91.13.53: Flags [.], ack 827, win 242, options [nop,nop,TS val 2265778 ecr 4144683016], length 0
    IP 199.7.91.13.53 > 172.31.44.118.47649: Flags [F.], seq 826, ack 54, win 114, options [nop,nop,TS val 4144683016 ecr 2265777], length 0
    IP 172.31.44.118.47649 > 199.7.91.13.53: Flags [.], ack 827, win 242, options [nop,nop,TS val 2265778 ecr 4144683016], length 0
    IP 156.154.103.3.53 > 172.31.44.118.33722: 20818-| 0/0/1 (52)
    IP 204.13.251.34.53 > 172.31.44.118.49733: 39472*- 1/1/1 CNAME twitter.com. (130)
    IP 172.31.44.118.42255 > 199.249.120.1.53: 50454% [1au] A? ns-1450.awsdns-53.org. (50)
    IP 172.31.44.118.42703 > 199.7.91.13.53: Flags [F.], seq 55, ack 810, win 241, options [nop,nop,TS val 2265778 ecr 4144671991], length 0
    IP 172.31.44.118.34147 > 199.7.91.13.53: Flags [F.], seq 55, ack 810, win 241, options [nop,nop,TS val 2265778 ecr 4145168455], length 0
    IP 199.249.120.1.53 > 172.31.44.118.54815: 14414-| 0/6/1 (391)
    IP 199.249.120.1.53 > 172.31.44.118.42255: 50454-| 0/6/1 (391)
    IP 199.7.91.13.53 > 172.31.44.118.42703: Flags [F.], seq 810, ack 56, win 114, options [nop,nop,TS val 4144671998 ecr 2265778], length 0
    IP 172.31.44.118.42703 > 199.7.91.13.53: Flags [.], ack 811, win 241, options [nop,nop,TS val 2265778 ecr 4144671998], length 0
    IP 199.7.91.13.53 > 172.31.44.118.34147: Flags [F.], seq 810, ack 56, win 114, options [nop,nop,TS val 4145168463 ecr 2265778], length 0
    IP 172.31.44.118.34147 > 199.7.91.13.53: Flags [.], ack 811, win 241, options [nop,nop,TS val 2265778 ecr 4145168463], length 0
    IP 204.13.250.34.53 > 172.31.44.118.37067: 8176*- 1/12/5 A 208.78.70.34 (418)
    IP 172.31.44.118.43552 > 192.5.5.241.53: 46518% [1au] AAAA? nsc.nic.uk. (39)
    IP 204.13.250.34.53 > 172.31.44.118.45114: 61351*- 0/1/1 (116)
    IP 172.31.44.118.46626 > 192.5.5.241.53: 8282% [1au] AAAA? nsd.nic.uk. (39)
    IP 172.31.44.118.50294 > 192.5.5.241.53: 48385% [1au] AAAA? nsb.nic.uk. (39)
    IP 172.31.44.118.32839 > 192.52.178.30.53: Flags [S], seq 868236579, win 29200, options [mss 1460,sackOK,TS val 2265778 ecr 0,nop,wscale 7], length 0
    IP 172.31.44.118.33383 > 192.5.5.241.53: 49422% [1au] AAAA? E.ROOT-SERVERS.NET. (47)
    IP 172.31.44.118.52371 > 192.5.5.241.53: 46054% [1au] AAAA? G.ROOT-SERVERS.NET. (47)
    IP 192.5.5.241.53 > 172.31.44.118.43552: 46518-| 0/2/1 (374)
    IP 172.31.44.118.52587 > 192.52.178.30.53: Flags [S], seq 3593923566, win 29200, options [mss 1460,sackOK,TS val 2265779 ecr 0,nop,wscale 7], length 0
    IP 192.5.5.241.53 > 172.31.44.118.46626: 8282-| 0/2/1 (374)
    IP 172.31.44.118.47279 > 192.52.178.30.53: Flags [S], seq 2747987677, win 29200, options [mss 1460,sackOK,TS val 2265779 ecr 0,nop,wscale 7], length 0
    IP 172.31.44.118.57381 > 156.154.103.3.53: Flags [S], seq 3951401876, win 29200, options [mss 1460,sackOK,TS val 2265779 ecr 0,nop,wscale 7], length 0
    IP 172.31.44.118.52097 > 156.154.103.3.53: Flags [S], seq 1777027035, win 29200, options [mss 1460,sackOK,TS val 2265779 ecr 0,nop,wscale 7], length 0
    IP 192.5.5.241.53 > 172.31.44.118.50294: 48385-| 0/2/1 (374)
    IP 204.13.250.34.53 > 172.31.44.118.39470: 4226*- 1/12/5 A 205.251.195.113 (418)
    IP 192.5.5.241.53 > 172.31.44.118.33383: 49422*- 1/0/1 AAAA 2001:500:a8::e (93)
    IP 192.5.5.241.53 > 172.31.44.118.52371: 46054*- 1/0/1 AAAA 2001:500:12::d0d (93)
    IP 204.13.250.34.53 > 172.31.44.118.54973: 20046*- 0/1/1 (116)
    IP 172.31.44.118.33561 > 199.249.120.1.53: Flags [S], seq 1701218816, win 29200, options [mss 1460,sackOK,TS val 2265779 ecr 0,nop,wscale 7], length 0
    IP 172.31.44.118.43553 > 199.249.120.1.53: Flags [S], seq 1381187344, win 29200, options [mss 1460,sackOK,TS val 2265779 ecr 0,nop,wscale 7], length 0
    IP 204.13.250.34.53 > 172.31.44.118.48004: 63574*- 0/1/1 (116)
    IP 156.154.103.3.53 > 172.31.44.118.57381: Flags [S.], seq 4136462966, ack 3951401877, win 14600, options [mss 1460,nop,nop,sackOK,nop,wscale 9], length 0
    IP 172.31.44.118.57381 > 156.154.103.3.53: Flags [.], ack 1, win 229, length 0
    IP 156.154.103.3.53 > 172.31.44.118.52097: Flags [S.], seq 3580675148, ack 1777027036, win 14600, options [mss 1460,nop,nop,sackOK,nop,wscale 9], length 0
    IP 172.31.44.118.52097 > 156.154.103.3.53: Flags [.], ack 1, win 229, length 0
    IP 192.52.178.30.53 > 172.31.44.118.50991: Flags [S.], seq 760121556, ack 1618516549, win 1460, options [mss 1460], length 0
    IP 172.31.44.118.50991 > 192.52.178.30.53: Flags [.], ack 1, win 29200, length 0
    IP 199.249.120.1.53 > 172.31.44.118.33561: Flags [S.], seq 4235746729, ack 1701218817, win 65160, options [mss 1460,sackOK,TS val 2791583424 ecr 2265779,nop,wscale 12], length 0
    IP 172.31.44.118.33561 > 199.249.120.1.53: Flags [.], ack 1, win 229, options [nop,nop,TS val 2265779 ecr 2791583424], length 0
    IP 199.249.120.1.53 > 172.31.44.118.43553: Flags [S.], seq 2528518283, ack 1381187345, win 65160, options [mss 1460,sackOK,TS val 2791583425 ecr 2265779,nop,wscale 12], length 0
    IP 172.31.44.118.43553 > 199.249.120.1.53: Flags [.], ack 1, win 229, options [nop,nop,TS val 2265779 ecr 2791583425], length 0
    IP 172.31.44.118.48447 > 192.26.92.30.53: 40614 [1au] DS? twitter.com. (40)
    IP 172.31.44.118.57381 > 156.154.103.3.53: Flags [P.], seq 1:55, ack 1, win 229, length 546993% [1au] A? ns-1700.awsdns-20.co.uk. (52)
    IP 204.13.250.34.53 > 172.31.44.118.39452: 35021*- 1/12/5 A 205.251.197.74 (418)
    IP 172.31.44.118.52097 > 156.154.103.3.53: Flags [P.], seq 1:55, ack 1, win 229, length 5450859% [1au] AAAA? ns-1700.awsdns-20.co.uk. (52)
    IP 172.31.44.118.54285 > 192.5.5.241.53: Flags [S], seq 1040241665, win 29200, options [mss 1460,sackOK,TS val 2265779 ecr 0,nop,wscale 7], length 0
    IP 172.31.44.118.42161 > 192.5.5.241.53: Flags [S], seq 3709538172, win 29200, options [mss 1460,sackOK,TS val 2265779 ecr 0,nop,wscale 7], length 0
    IP 172.31.44.118.43991 > 192.5.5.241.53: Flags [S], seq 648979130, win 29200, options [mss 1460,sackOK,TS val 2265779 ecr 0,nop,wscale 7], length 0
    IP 172.31.44.118.33561 > 199.249.120.1.53: Flags [P.], seq 1:53, ack 1, win 229, options [nop,nop,TS val 2265779 ecr 2791583424], length 5260341% [1au] AAAA? ns-1450.awsdns-53.org. (50)
    IP 172.31.44.118.43553 > 199.249.120.1.53: Flags [P.], seq 1:53, ack 1, win 229, options [nop,nop,TS val 2265779 ecr 2791583425], length 5211759% [1au] A? ns-1450.awsdns-53.org. (50)
    IP 204.13.250.34.53 > 172.31.44.118.39621: 16665*- 0/1/1 (116)
    IP 172.31.44.118.50991 > 192.52.178.30.53: Flags [P.], seq 1:62, ack 1, win 29200, length 6117480% [1au] AAAA? ns4.dynamicnetworkservices.net. (59)
    IP 156.154.103.3.53 > 172.31.44.118.52097: Flags [.], ack 55, win 29, length 0
    IP 156.154.103.3.53 > 172.31.44.118.57381: Flags [.], ack 55, win 29, length 0
    IP 192.5.5.241.53 > 172.31.44.118.54285: Flags [S.], seq 1333917576, ack 1040241666, win 29200, options [mss 1460,nop,nop,sackOK,nop,wscale 10], length 0
    IP 172.31.44.118.54285 > 192.5.5.241.53: Flags [.], ack 1, win 229, length 0
    IP 192.5.5.241.53 > 172.31.44.118.42161: Flags [S.], seq 3326462717, ack 3709538173, win 29200, options [mss 1460,nop,nop,sackOK,nop,wscale 10], length 0
    IP 172.31.44.118.42161 > 192.5.5.241.53: Flags [.], ack 1, win 229, length 0
    IP 192.26.92.30.53 > 172.31.44.118.48447: 40614*-| 0/4/1 (435)
    IP 156.154.103.3.53 > 172.31.44.118.57381: Flags [P.], seq 1:848, ack 55, win 29, length 8476993- 0/8/9 (845)
    IP 172.31.44.118.57381 > 156.154.103.3.53: Flags [.], ack 848, win 242, length 0
    IP 156.154.103.3.53 > 172.31.44.118.52097: Flags [P.], seq 1:848, ack 55, win 29, length 84750859- 0/8/9 (845)
    IP 172.31.44.118.52097 > 156.154.103.3.53: Flags [.], ack 848, win 242, length 0
    IP 204.13.250.34.53 > 172.31.44.118.41831: 19959*- 1/12/5 A 204.13.250.34 (418)
    IP 192.5.5.241.53 > 172.31.44.118.43991: Flags [S.], seq 3891453567, ack 648979131, win 29200, options [mss 1460,nop,nop,sackOK,nop,wscale 10], length 0
    IP 172.31.44.118.43991 > 192.5.5.241.53: Flags [.], ack 1, win 229, length 0
    IP 199.249.120.1.53 > 172.31.44.118.33561: Flags [.], ack 53, win 16, options [nop,nop,TS val 2791583427 ecr 2265779], length 0
    IP 199.249.120.1.53 > 172.31.44.118.33561: Flags [P.], seq 1:808, ack 53, win 16, options [nop,nop,TS val 2791583427 ecr 2265779], length 80760341- 0/8/9 (805)
    IP 172.31.44.118.33561 > 199.249.120.1.53: Flags [.], ack 808, win 241, options [nop,nop,TS val 2265780 ecr 2791583427], length 0
    IP 199.249.120.1.53 > 172.31.44.118.43553: Flags [.], ack 53, win 16, options [nop,nop,TS val 2791583427 ecr 2265779], length 0
    IP 199.249.120.1.53 > 172.31.44.118.43553: Flags [P.], seq 1:808, ack 53, win 16, options [nop,nop,TS val 2791583427 ecr 2265779], length 80711759- 0/8/9 (805)
    IP 172.31.44.118.43553 > 199.249.120.1.53: Flags [.], ack 808, win 241, options [nop,nop,TS val 2265780 ecr 2791583427], length 0
    IP 172.31.44.118.54285 > 192.5.5.241.53: Flags [P.], seq 1:42, ack 1, win 229, length 4161040% [1au] AAAA? nsc.nic.uk. (39)
    IP 172.31.44.118.42161 > 192.5.5.241.53: Flags [P.], seq 1:42, ack 1, win 229, length 4126662% [1au] AAAA? nsd.nic.uk. (39)
    IP 172.31.44.118.43991 > 192.5.5.241.53: Flags [P.], seq 1:42, ack 1, win 229, length 4129376% [1au] AAAA? nsb.nic.uk. (39)
    IP 172.31.44.118.57155 > 192.26.92.30.53: Flags [S], seq 1983151439, win 29200, options [mss 1460,sackOK,TS val 2265780 ecr 0,nop,wscale 7], length 0
    IP 192.5.5.241.53 > 172.31.44.118.54285: Flags [.], ack 42, win 29, length 0
    IP 192.5.5.241.53 > 172.31.44.118.42161: Flags [.], ack 42, win 29, length 0
    IP 192.5.5.241.53 > 172.31.44.118.54285: Flags [P.], seq 1:789, ack 42, win 29, length 78861040- 0/10/14 (786)
    IP 172.31.44.118.54285 > 192.5.5.241.53: Flags [.], ack 789, win 241, length 0
    IP 192.5.5.241.53 > 172.31.44.118.43991: Flags [.], ack 42, win 29, length 0
    IP 192.5.5.241.53 > 172.31.44.118.42161: Flags [P.], seq 1:789, ack 42, win 29, length 78826662- 0/10/14 (786)
    IP 172.31.44.118.42161 > 192.5.5.241.53: Flags [.], ack 789, win 241, length 0
    IP 192.5.5.241.53 > 172.31.44.118.43991: Flags [P.], seq 1:789, ack 42, win 29, length 78829376- 0/10/14 (786)
    IP 172.31.44.118.43991 > 192.5.5.241.53: Flags [.], ack 789, win 241, length 0
    IP 172.31.44.118.36142 > 205.251.199.24.53: 16980% [1au] A? ns-1700.awsdns-20.co.uk. (52)
    IP 192.26.92.30.53 > 172.31.44.118.57155: Flags [S.], seq 1725376915, ack 1983151440, win 1460, options [mss 1460], length 0
    IP 172.31.44.118.57155 > 192.26.92.30.53: Flags [.], ack 1, win 29200, length 0
    IP 172.31.44.118.42705 > 205.251.199.24.53: 5528% [1au] AAAA? ns-1700.awsdns-20.co.uk. (52)
    IP 205.251.199.24.53 > 172.31.44.118.36142: 16980*- 1/4/9 A 205.251.198.164 (338)
    IP 205.251.199.24.53 > 172.31.44.118.42705: 5528*- 1/4/9 AAAA 2600:9000:5306:a400::1 (350)
    IP 172.31.44.118.57381 > 156.154.103.3.53: Flags [F.], seq 55, ack 848, win 242, length 0
    IP 172.31.44.118.52097 > 156.154.103.3.53: Flags [F.], seq 55, ack 848, win 242, length 0
    IP 172.31.44.118.57155 > 192.26.92.30.53: Flags [P.], seq 1:43, ack 1, win 29200, length 42490 [1au] DS? twitter.com. (40)
    IP 172.31.44.118.33561 > 199.249.120.1.53: Flags [F.], seq 53, ack 808, win 241, options [nop,nop,TS val 2265781 ecr 2791583427], length 0
    IP 172.31.44.118.43553 > 199.249.120.1.53: Flags [F.], seq 53, ack 808, win 241, options [nop,nop,TS val 2265781 ecr 2791583427], length 0
    IP 192.26.92.30.53 > 172.31.44.118.57155: Flags [P.], seq 1:764, ack 43, win 65535, length 763490*- 0/6/1 (761)
    IP 172.31.44.118.57155 > 192.26.92.30.53: Flags [.], ack 764, win 30520, length 0
    IP 156.154.103.3.53 > 172.31.44.118.57381: Flags [F.], seq 848, ack 56, win 29, length 0
    IP 172.31.44.118.57381 > 156.154.103.3.53: Flags [.], ack 849, win 242, length 0
    IP 156.154.103.3.53 > 172.31.44.118.52097: Flags [F.], seq 848, ack 56, win 29, length 0
    IP 172.31.44.118.52097 > 156.154.103.3.53: Flags [.], ack 849, win 242, length 0
    IP 199.249.120.1.53 > 172.31.44.118.33561: Flags [F.], seq 808, ack 54, win 16, options [nop,nop,TS val 2791583434 ecr 2265781], length 0
    IP 172.31.44.118.33561 > 199.249.120.1.53: Flags [.], ack 809, win 241, options [nop,nop,TS val 2265782 ecr 2791583434], length 0
    IP 199.249.120.1.53 > 172.31.44.118.43553: Flags [F.], seq 808, ack 54, win 16, options [nop,nop,TS val 2791583434 ecr 2265781], length 0
    IP 172.31.44.118.43553 > 199.249.120.1.53: Flags [.], ack 809, win 241, options [nop,nop,TS val 2265782 ecr 2791583434], length 0
    IP 192.52.178.30.53 > 172.31.44.118.47279: Flags [S.], seq 3361181579, ack 2747987678, win 1460, options [mss 1460], length 0
    IP 172.31.44.118.47279 > 192.52.178.30.53: Flags [.], ack 1, win 29200, length 0
    IP 192.52.178.30.53 > 172.31.44.118.52587: Flags [S.], seq 3697186169, ack 3593923567, win 1460, options [mss 1460], length 0
    IP 172.31.44.118.52587 > 192.52.178.30.53: Flags [.], ack 1, win 29200, length 0
    IP 192.52.178.30.53 > 172.31.44.118.32839: Flags [S.], seq 3400474683, ack 868236580, win 1460, options [mss 1460], length 0
    IP 172.31.44.118.32839 > 192.52.178.30.53: Flags [.], ack 1, win 29200, length 0
    IP 172.31.44.118.54010 > 103.49.80.1.53: 56922% [1au] AAAA? nsc.nic.uk. (39)
    IP 172.31.44.118.36696 > 103.49.80.1.53: 16930% [1au] AAAA? nsd.nic.uk. (39)
    IP 172.31.44.118.44114 > 103.49.80.1.53: 23655% [1au] AAAA? nsb.nic.uk. (39)
    IP 103.49.80.1.53 > 172.31.44.118.54010: 56922*- 0/1/1 (91)
    IP 103.49.80.1.53 > 172.31.44.118.36696: 16930*- 0/1/1 (91)
    IP 172.31.44.118.49291 > 205.251.198.117.53: 30795% [1au] AAAA? ns-1450.awsdns-53.org. (50)
    IP 192.52.178.30.53 > 172.31.44.118.50991: Flags [P.], seq 1:921, ack 62, win 65535, length 92017480- 0/11/13 (918)
    IP 172.31.44.118.50991 > 192.52.178.30.53: Flags [.], ack 921, win 30360, length 0
    IP 103.49.80.1.53 > 172.31.44.118.44114: 23655*- 0/1/1 (91)
    IP 172.31.44.118.51243 > 205.251.198.117.53: 57273% [1au] A? ns-1450.awsdns-53.org. (50)
    IP 172.31.44.118.54285 > 192.5.5.241.53: Flags [F.], seq 42, ack 789, win 241, length 0
    IP 172.31.44.118.47279 > 192.52.178.30.53: Flags [P.], seq 1:52, ack 1, win 29200, length 5141597% [1au] AAAA? ns-370.awsdns-46.com. (49)
    IP 172.31.44.118.52587 > 192.52.178.30.53: Flags [P.], seq 1:52, ack 1, win 29200, length 5161908% [1au] A? ns-370.awsdns-46.com. (49)
    IP 172.31.44.118.32839 > 192.52.178.30.53: Flags [P.], seq 1:62, ack 1, win 29200, length 6150612% [1au] AAAA? ns2.dynamicnetworkservices.net. (59)
    IP 205.251.198.117.53 > 172.31.44.118.49291: 30795*- 1/4/9 AAAA 2600:9000:5305:aa00::1 (348)
    IP 172.31.44.118.42161 > 192.5.5.241.53: Flags [F.], seq 42, ack 789, win 241, length 0
    IP 172.31.44.118.43991 > 192.5.5.241.53: Flags [F.], seq 42, ack 789, win 241, length 0
    IP 172.31.44.118.57155 > 192.26.92.30.53: Flags [F.], seq 43, ack 764, win 30520, length 0
    IP 205.251.198.117.53 > 172.31.44.118.51243: 57273*- 1/4/9 A 205.251.197.170 (336)
    IP 172.31.44.118.44791 > 208.78.70.136.53: 65278% [1au] AAAA? ns4.dynamicnetworkservices.net. (59)
    IP 172.31.44.118.50991 > 192.52.178.30.53: Flags [F.], seq 62, ack 921, win 30360, length 0
    IP 192.26.92.30.53 > 172.31.44.118.57155: Flags [.], ack 44, win 65535, length 0
    IP 192.26.92.30.53 > 172.31.44.118.57155: Flags [F.], seq 764, ack 44, win 65535, length 0
    IP 172.31.44.118.57155 > 192.26.92.30.53: Flags [.], ack 765, win 30520, length 0
    IP 172.31.44.118.50592 > 208.78.70.34.53: 1363 [1au] AAAA? twitter.com. (40)
    IP 172.31.44.118.53443 > 208.78.70.34.53: 60709 [1au] A? twitter.com. (40)
    IP 192.52.178.30.53 > 172.31.44.118.52587: Flags [P.], seq 1:806, ack 52, win 65535, length 80561908- 0/8/9 (803)
    IP 172.31.44.118.52587 > 192.52.178.30.53: Flags [.], ack 806, win 30590, length 0
    IP 172.31.44.118.52183 > 205.251.194.110.53: 36033% [1au] A? ns-370.awsdns-46.com. (49)
    IP 172.31.44.118.52587 > 192.52.178.30.53: Flags [F.], seq 52, ack 806, win 30590, length 0
    IP 192.52.178.30.53 > 172.31.44.118.47279: Flags [P.], seq 1:806, ack 52, win 65535, length 80541597- 0/8/9 (803)
    IP 172.31.44.118.47279 > 192.52.178.30.53: Flags [.], ack 806, win 30590, length 0
    IP 172.31.44.118.51729 > 205.251.194.110.53: 20989% [1au] AAAA? ns-370.awsdns-46.com. (49)
    IP 172.31.44.118.47279 > 192.52.178.30.53: Flags [F.], seq 52, ack 806, win 30590, length 0
    IP 192.52.178.30.53 > 172.31.44.118.32839: Flags [P.], seq 1:921, ack 62, win 65535, length 92050612- 0/11/13 (918)
    IP 172.31.44.118.32839 > 192.52.178.30.53: Flags [.], ack 921, win 30360, length 0
    IP 205.251.194.110.53 > 172.31.44.118.52183: 36033*- 1/4/9 A 205.251.193.114 (334)
    IP 172.31.44.118.46511 > 208.78.70.136.53: 24052% [1au] AAAA? ns2.dynamicnetworkservices.net. (59)
    IP 172.31.44.118.32839 > 192.52.178.30.53: Flags [F.], seq 62, ack 921, win 30360, length 0
    IP 192.52.178.30.53 > 172.31.44.118.50991: Flags [.], ack 63, win 65535, length 0
    IP 192.52.178.30.53 > 172.31.44.118.50991: Flags [F.], seq 921, ack 63, win 65535, length 0
    IP 172.31.44.118.50991 > 192.52.178.30.53: Flags [.], ack 922, win 30360, length 0
    IP 205.251.194.110.53 > 172.31.44.118.51729: 20989*- 1/4/9 AAAA 2600:9000:5301:7200::1 (346)
    IP 208.78.70.136.53 > 172.31.44.118.44791: 65278*- 0/1/1 (120)
    IP 208.78.70.34.53 > 172.31.44.118.53443: 60709*- 2/9/1 A 104.244.42.193, A 104.244.42.65 (273)
    IP 208.78.70.34.53 > 172.31.44.118.50592: 1363*- 0/1/1 (112)
    IP 172.31.44.118.53 > 172.31.23.244.36810: 11676 3/6/3 CNAME twitter.com., A 104.244.42.65, A 104.244.42.193 (284)
    IP 172.31.44.118.53 > 172.31.23.244.36810: 36142 1/1/0 CNAME twitter.com. (119)
    IP 192.52.178.30.53 > 172.31.44.118.47279: Flags [.], ack 53, win 65535, length 0
    IP 192.52.178.30.53 > 172.31.44.118.47279: Flags [F.], seq 806, ack 53, win 65535, length 0
    IP 172.31.44.118.47279 > 192.52.178.30.53: Flags [.], ack 807, win 30590, length 0
    IP 192.52.178.30.53 > 172.31.44.118.52587: Flags [.], ack 53, win 65535, length 0
    IP 192.52.178.30.53 > 172.31.44.118.52587: Flags [F.], seq 806, ack 53, win 65535, length 0
    IP 172.31.44.118.52587 > 192.52.178.30.53: Flags [.], ack 807, win 30590, length 0
    IP 192.42.93.30.53 > 172.31.44.118.59713: Flags [.], ack 51, win 65535, length 0
    IP 192.42.93.30.53 > 172.31.44.118.59713: Flags [F.], seq 936, ack 51, win 65535, length 0
    IP 172.31.44.118.59713 > 192.42.93.30.53: Flags [.], ack 937, win 30855, length 0
    IP 192.52.178.30.53 > 172.31.44.118.32839: Flags [.], ack 63, win 65535, length 0
    IP 192.52.178.30.53 > 172.31.44.118.32839: Flags [F.], seq 921, ack 63, win 65535, length 0
    IP 172.31.44.118.32839 > 192.52.178.30.53: Flags [.], ack 922, win 30360, length 0
    IP 208.78.70.136.53 > 172.31.44.118.46511: 24052*- 0/1/1 (120)
    IP 192.42.93.30.53 > 172.31.44.118.57497: Flags [.], ack 51, win 65535, length 0
    IP 192.42.93.30.53 > 172.31.44.118.57497: Flags [F.], seq 936, ack 51, win 65535, length 0
    IP 172.31.44.118.57497 > 192.42.93.30.53: Flags [.], ack 937, win 30855, length 0
    IP 192.42.93.30.53 > 172.31.44.118.38117: Flags [.], ack 51, win 65535, length 0
    IP 192.42.93.30.53 > 172.31.44.118.38117: Flags [F.], seq 936, ack 51, win 65535, length 0
    IP 172.31.44.118.38117 > 192.42.93.30.53: Flags [.], ack 937, win 30855, length 0
    IP 192.42.93.30.53 > 172.31.44.118.56701: Flags [.], ack 54, win 65535, length 0
    IP 192.42.93.30.53 > 172.31.44.118.56701: Flags [F.], seq 854, ack 54, win 65535, length 0
    IP 172.31.44.118.56701 > 192.42.93.30.53: Flags [.], ack 855, win 30708, length 0
    IP 192.42.93.30.53 > 172.31.44.118.35949: Flags [.], ack 51, win 65535, length 0
    IP 192.42.93.30.53 > 172.31.44.118.35949: Flags [F.], seq 936, ack 51, win 65535, length 0
    IP 172.31.44.118.35949 > 192.42.93.30.53: Flags [.], ack 937, win 30855, length 0
    IP 192.42.93.30.53 > 172.31.44.118.56645: Flags [.], ack 54, win 65535, length 0
    IP 192.42.93.30.53 > 172.31.44.118.56645: Flags [F.], seq 854, ack 54, win 65535, length 0
    IP 172.31.44.118.56645 > 192.42.93.30.53: Flags [.], ack 855, win 30708, length 0
    IP 192.42.93.30.53 > 172.31.44.118.60985: Flags [.], ack 54, win 65535, length 0
    IP 192.42.93.30.53 > 172.31.44.118.60985: Flags [F.], seq 854, ack 54, win 65535, length 0
    IP 172.31.44.118.60985 > 192.42.93.30.53: Flags [.], ack 855, win 30708, length 0
    IP 192.42.93.30.53 > 172.31.44.118.47705: Flags [.], ack 54, win 65535, length 0
    IP 192.42.93.30.53 > 172.31.44.118.47705: Flags [F.], seq 854, ack 54, win 65535, length 0
    IP 172.31.44.118.47705 > 192.42.93.30.53: Flags [.], ack 855, win 30708, length 0
    IP 192.42.93.30.53 > 172.31.44.118.54701: Flags [.], ack 54, win 65535, length 0
    IP 192.42.93.30.53 > 172.31.44.118.54701: Flags [F.], seq 854, ack 54, win 65535, length 0
    IP 172.31.44.118.54701 > 192.42.93.30.53: Flags [.], ack 855, win 30708, length 0
    IP 192.42.93.30.53 > 172.31.44.118.47223: Flags [.], ack 54, win 65535, length 0
    IP 192.42.93.30.53 > 172.31.44.118.47223: Flags [F.], seq 854, ack 54, win 65535, length 0
    IP 172.31.44.118.47223 > 192.42.93.30.53: Flags [.], ack 855, win 30708, length 0
    IP 192.42.93.30.53 > 172.31.44.118.56583: Flags [.], ack 54, win 65535, length 0
    IP 192.42.93.30.53 > 172.31.44.118.56583: Flags [F.], seq 854, ack 54, win 65535, length 0
    IP 172.31.44.118.56583 > 192.42.93.30.53: Flags [.], ack 855, win 30708, length 0
    IP 192.5.5.241.53 > 172.31.44.118.54285: Flags [.], ack 43, win 29, length 0
    IP 192.42.93.30.53 > 172.31.44.118.45727: Flags [.], ack 54, win 65535, length 0
    IP 192.42.93.30.53 > 172.31.44.118.45727: Flags [F.], seq 854, ack 54, win 65535, length 0
    IP 172.31.44.118.45727 > 192.42.93.30.53: Flags [.], ack 855, win 30708, length 0
    IP 192.5.5.241.53 > 172.31.44.118.42161: Flags [.], ack 43, win 29, length 0
    IP 192.5.5.241.53 > 172.31.44.118.43991: Flags [.], ack 43, win 29, length 0
    IP 172.31.44.118.53131 > 198.97.190.53.53: Flags [F.], seq 50, ack 1178, win 247, length 0
    IP 172.31.44.118.36341 > 198.97.190.53.53: Flags [F.], seq 50, ack 1178, win 247, length 0
    IP 172.31.44.118.44155 > 198.97.190.53.53: Flags [F.], seq 53, ack 1181, win 247, length 0
    IP 172.31.44.118.34607 > 198.97.190.53.53: Flags [F.], seq 53, ack 1181, win 247, length 0
    IP 172.31.44.118.43383 > 198.97.190.53.53: Flags [F.], seq 53, ack 1181, win 247, length 0
    IP 172.31.44.118.43681 > 198.97.190.53.53: Flags [F.], seq 53, ack 1181, win 247, length 0
    IP 172.31.44.118.46307 > 198.97.190.53.53: Flags [F.], seq 53, ack 1181, win 247, length 0
    IP 172.31.44.118.49341 > 198.97.190.53.53: Flags [F.], seq 53, ack 1181, win 247, length 0
    IP 172.31.44.118.59745 > 198.97.190.53.53: Flags [F.], seq 53, ack 1181, win 247, length 0
    IP 172.31.44.118.41939 > 198.97.190.53.53: Flags [F.], seq 53, ack 1181, win 247, length 0
    IP 172.31.44.118.40243 > 198.97.190.53.53: Flags [F.], seq 31, ack 1100, win 246, length 0
    IP 172.31.44.118.55695 > 198.97.190.53.53: Flags [F.], seq 50, ack 1178, win 247, length 0
    IP 172.31.44.118.37415 > 198.97.190.53.53: Flags [F.], seq 50, ack 1178, win 247, length 0
    IP6 fe80::c4f:f2ff:fe13:756.546 > ff02::1:2.547: dhcp6 solicit
    IP 172.31.44.118.37415 > 198.97.190.53.53: Flags [F.], seq 50, ack 1178, win 247, length 0
    IP 172.31.44.118.55695 > 198.97.190.53.53: Flags [F.], seq 50, ack 1178, win 247, length 0
    IP 172.31.44.118.40243 > 198.97.190.53.53: Flags [F.], seq 31, ack 1100, win 246, length 0
    IP 172.31.44.118.41939 > 198.97.190.53.53: Flags [F.], seq 53, ack 1181, win 247, length 0
    IP 172.31.44.118.59745 > 198.97.190.53.53: Flags [F.], seq 53, ack 1181, win 247, length 0
    IP 172.31.44.118.49341 > 198.97.190.53.53: Flags [F.], seq 53, ack 1181, win 247, length 0
    IP 172.31.44.118.46307 > 198.97.190.53.53: Flags [F.], seq 53, ack 1181, win 247, length 0
    IP 172.31.44.118.43681 > 198.97.190.53.53: Flags [F.], seq 53, ack 1181, win 247, length 0
    IP 172.31.44.118.43383 > 198.97.190.53.53: Flags [F.], seq 53, ack 1181, win 247, length 0
    IP 172.31.44.118.34607 > 198.97.190.53.53: Flags [F.], seq 53, ack 1181, win 247, length 0
    IP 172.31.44.118.44155 > 198.97.190.53.53: Flags [F.], seq 53, ack 1181, win 247, length 0
    IP 172.31.44.118.36341 > 198.97.190.53.53: Flags [F.], seq 50, ack 1178, win 247, length 0
    IP 172.31.44.118.53131 > 198.97.190.53.53: Flags [F.], seq 50, ack 1178, win 247, length 0
    IP 172.31.44.118.53131 > 198.97.190.53.53: Flags [F.], seq 50, ack 1178, win 247, length 0
    IP 172.31.44.118.36341 > 198.97.190.53.53: Flags [F.], seq 50, ack 1178, win 247, length 0
    IP 172.31.44.118.44155 > 198.97.190.53.53: Flags [F.], seq 53, ack 1181, win 247, length 0
    IP 172.31.44.118.34607 > 198.97.190.53.53: Flags [F.], seq 53, ack 1181, win 247, length 0
    IP 172.31.44.118.43383 > 198.97.190.53.53: Flags [F.], seq 53, ack 1181, win 247, length 0
    IP 172.31.44.118.43681 > 198.97.190.53.53: Flags [F.], seq 53, ack 1181, win 247, length 0
    IP 172.31.44.118.46307 > 198.97.190.53.53: Flags [F.], seq 53, ack 1181, win 247, length 0
    IP 172.31.44.118.49341 > 198.97.190.53.53: Flags [F.], seq 53, ack 1181, win 247, length 0
    IP 172.31.44.118.59745 > 198.97.190.53.53: Flags [F.], seq 53, ack 1181, win 247, length 0
    IP 172.31.44.118.41939 > 198.97.190.53.53: Flags [F.], seq 53, ack 1181, win 247, length 0
    IP 172.31.44.118.40243 > 198.97.190.53.53: Flags [F.], seq 31, ack 1100, win 246, length 0
    IP 172.31.44.118.55695 > 198.97.190.53.53: Flags [F.], seq 50, ack 1178, win 247, length 0
    IP 172.31.44.118.37415 > 198.97.190.53.53: Flags [F.], seq 50, ack 1178, win 247, length 0
    IP 192.5.5.241.53 > 172.31.44.118.43991: Flags [F.], seq 789, ack 43, win 29, length 0
    IP 172.31.44.118.43991 > 192.5.5.241.53: Flags [.], ack 790, win 241, length 0
    IP 172.31.44.118.37415 > 198.97.190.53.53: Flags [F.], seq 50, ack 1178, win 247, length 0
    IP 172.31.44.118.55695 > 198.97.190.53.53: Flags [F.], seq 50, ack 1178, win 247, length 0
    IP 172.31.44.118.40243 > 198.97.190.53.53: Flags [F.], seq 31, ack 1100, win 246, length 0
    IP 172.31.44.118.41939 > 198.97.190.53.53: Flags [F.], seq 53, ack 1181, win 247, length 0
    IP 172.31.44.118.59745 > 198.97.190.53.53: Flags [F.], seq 53, ack 1181, win 247, length 0
    IP 172.31.44.118.49341 > 198.97.190.53.53: Flags [F.], seq 53, ack 1181, win 247, length 0
    IP 172.31.44.118.46307 > 198.97.190.53.53: Flags [F.], seq 53, ack 1181, win 247, length 0
    IP 172.31.44.118.43681 > 198.97.190.53.53: Flags [F.], seq 53, ack 1181, win 247, length 0
    IP 172.31.44.118.43383 > 198.97.190.53.53: Flags [F.], seq 53, ack 1181, win 247, length 0
    IP 172.31.44.118.34607 > 198.97.190.53.53: Flags [F.], seq 53, ack 1181, win 247, length 0
    IP 172.31.44.118.44155 > 198.97.190.53.53: Flags [F.], seq 53, ack 1181, win 247, length 0
    IP 172.31.44.118.36341 > 198.97.190.53.53: Flags [F.], seq 50, ack 1178, win 247, length 0
    IP 172.31.44.118.53131 > 198.97.190.53.53: Flags [F.], seq 50, ack 1178, win 247, length 0
    IP 192.5.5.241.53 > 172.31.44.118.54285: Flags [F.], seq 789, ack 43, win 29, length 0
    IP 172.31.44.118.54285 > 192.5.5.241.53: Flags [.], ack 790, win 241, length 0
    IP 172.31.44.118.53131 > 198.97.190.53.53: Flags [F.], seq 50, ack 1178, win 247, length 0
    IP 172.31.44.118.36341 > 198.97.190.53.53: Flags [F.], seq 50, ack 1178, win 247, length 0
    IP 172.31.44.118.44155 > 198.97.190.53.53: Flags [F.], seq 53, ack 1181, win 247, length 0
    IP 172.31.44.118.34607 > 198.97.190.53.53: Flags [F.], seq 53, ack 1181, win 247, length 0
    IP 172.31.44.118.43383 > 198.97.190.53.53: Flags [F.], seq 53, ack 1181, win 247, length 0
    IP 172.31.44.118.43681 > 198.97.190.53.53: Flags [F.], seq 53, ack 1181, win 247, length 0
    IP 172.31.44.118.46307 > 198.97.190.53.53: Flags [F.], seq 53, ack 1181, win 247, length 0
    IP 172.31.44.118.49341 > 198.97.190.53.53: Flags [F.], seq 53, ack 1181, win 247, length 0
    IP 172.31.44.118.59745 > 198.97.190.53.53: Flags [F.], seq 53, ack 1181, win 247, length 0
    IP 172.31.44.118.41939 > 198.97.190.53.53: Flags [F.], seq 53, ack 1181, win 247, length 0
    IP 172.31.44.118.40243 > 198.97.190.53.53: Flags [F.], seq 31, ack 1100, win 246, length 0
    IP 172.31.44.118.55695 > 198.97.190.53.53: Flags [F.], seq 50, ack 1178, win 247, length 0
    IP 172.31.44.118.37415 > 198.97.190.53.53: Flags [F.], seq 50, ack 1178, win 247, length 0
    IP 198.97.190.53.53 > 172.31.44.118.55695: Flags [F.], seq 1178, ack 50, win 6, length 0
    IP 172.31.44.118.55695 > 198.97.190.53.53: Flags [.], ack 1179, win 247, length 0
    IP 198.97.190.53.53 > 172.31.44.118.37415: Flags [F.], seq 1178, ack 50, win 6, length 0
    IP 172.31.44.118.37415 > 198.97.190.53.53: Flags [.], ack 1179, win 247, length 0
    IP 198.97.190.53.53 > 172.31.44.118.53131: Flags [F.], seq 1178, ack 50, win 6, length 0
    IP 172.31.44.118.53131 > 198.97.190.53.53: Flags [.], ack 1179, win 247, length 0
    IP 198.97.190.53.53 > 172.31.44.118.34607: Flags [F.], seq 1181, ack 53, win 6, length 0
    IP 172.31.44.118.34607 > 198.97.190.53.53: Flags [.], ack 1182, win 247, length 0
    IP 198.97.190.53.53 > 172.31.44.118.36341: Flags [F.], seq 1178, ack 50, win 6, length 0
    IP 172.31.44.118.36341 > 198.97.190.53.53: Flags [.], ack 1179, win 247, length 0
    IP 198.97.190.53.53 > 172.31.44.118.44155: Flags [F.], seq 1181, ack 53, win 6, length 0
    IP 172.31.44.118.44155 > 198.97.190.53.53: Flags [.], ack 1182, win 247, length 0
    IP 198.97.190.53.53 > 172.31.44.118.43681: Flags [F.], seq 1181, ack 53, win 6, length 0
    IP 172.31.44.118.43681 > 198.97.190.53.53: Flags [.], ack 1182, win 247, length 0
    IP 198.97.190.53.53 > 172.31.44.118.46307: Flags [F.], seq 1181, ack 53, win 6, length 0
    IP 172.31.44.118.46307 > 198.97.190.53.53: Flags [.], ack 1182, win 247, length 0
    IP 198.97.190.53.53 > 172.31.44.118.43383: Flags [F.], seq 1181, ack 53, win 6, length 0
    IP 172.31.44.118.43383 > 198.97.190.53.53: Flags [.], ack 1182, win 247, length 0
    IP 198.97.190.53.53 > 172.31.44.118.49341: Flags [F.], seq 1181, ack 53, win 6, length 0
    IP 172.31.44.118.49341 > 198.97.190.53.53: Flags [.], ack 1182, win 247, length 0
    IP 198.97.190.53.53 > 172.31.44.118.59745: Flags [F.], seq 1181, ack 53, win 6, length 0
    IP 172.31.44.118.59745 > 198.97.190.53.53: Flags [.], ack 1182, win 247, length 0
    IP 198.97.190.53.53 > 172.31.44.118.41939: Flags [F.], seq 1181, ack 53, win 6, length 0
    IP 172.31.44.118.41939 > 198.97.190.53.53: Flags [.], ack 1182, win 247, length 0
    IP 198.97.190.53.53 > 172.31.44.118.40243: Flags [F.], seq 1100, ack 31, win 6, length 0
    IP 172.31.44.118.40243 > 198.97.190.53.53: Flags [.], ack 1101, win 246, length 0
    IP 172.31.44.118.37415 > 198.97.190.53.53: Flags [F.], seq 50, ack 1179, win 247, length 0
    IP 172.31.44.118.55695 > 198.97.190.53.53: Flags [F.], seq 50, ack 1179, win 247, length 0
    IP 172.31.44.118.40243 > 198.97.190.53.53: Flags [F.], seq 31, ack 1101, win 246, length 0
    IP 172.31.44.118.41939 > 198.97.190.53.53: Flags [F.], seq 53, ack 1182, win 247, length 0
    IP 172.31.44.118.59745 > 198.97.190.53.53: Flags [F.], seq 53, ack 1182, win 247, length 0
    IP 172.31.44.118.49341 > 198.97.190.53.53: Flags [F.], seq 53, ack 1182, win 247, length 0
    IP 172.31.44.118.46307 > 198.97.190.53.53: Flags [F.], seq 53, ack 1182, win 247, length 0
    IP 172.31.44.118.43681 > 198.97.190.53.53: Flags [F.], seq 53, ack 1182, win 247, length 0
    IP 172.31.44.118.43383 > 198.97.190.53.53: Flags [F.], seq 53, ack 1182, win 247, length 0
    IP 172.31.44.118.34607 > 198.97.190.53.53: Flags [F.], seq 53, ack 1182, win 247, length 0
    IP 172.31.44.118.44155 > 198.97.190.53.53: Flags [F.], seq 53, ack 1182, win 247, length 0
    IP 172.31.44.118.36341 > 198.97.190.53.53: Flags [F.], seq 50, ack 1179, win 247, length 0
    IP 172.31.44.118.53131 > 198.97.190.53.53: Flags [F.], seq 50, ack 1179, win 247, length 0
